{
  "schema_version": "0.1.0-draft",
  "strategy_id": "industrial_bottleneck_event",
  "bundle_id": "industrial_event_stage6_6b_historical_admission_atomic_retention",
  "bundle_version": "0.1.0",
  "declared_status": "approved",
  "rules": {
    "authorization_boundary": {
      "approval_scope": "stage6_historical_admission_validation",
      "allowed_run_modes": [],
      "validation_capability_issued": true,
      "authorizes_implementation": true,
      "authorizes_validation_only_public_https_read": true,
      "authorizes_validation_only_confirmation": true,
      "authorizes_validation_only_seal": true,
      "authorizes_formal_historical_run": false,
      "authorizes_strategy_evaluator": false,
      "authorizes_development": false,
      "authorizes_walk_forward": false,
      "authorizes_holdout_open": false,
      "authorizes_formal_state_migration": false,
      "authorizes_backtest": false,
      "authorizes_paper": false,
      "authorizes_shadow": false,
      "authorizes_live": false,
      "authorizes_positions": false,
      "authorizes_orders": false,
      "authorizes_broker_connection": false,
      "authorizes_kb_internal_reads": false,
      "authorizes_kb_writes": false,
      "authorizes_funds_deployment": false,
      "authority_eligible": false
    },
    "batch": {
      "stage": "Stage 6",
      "batch_id": "6B",
      "purpose": "approved_historical_admission_validation_governance",
      "owner_approval_required": true,
      "approval_items_required": 32,
      "approved_items": 32,
      "approved_machine_bundle_exists": true,
      "approval_record_exists": true,
      "validation_capability_verifier_exists": true,
      "runtime_code_exists": false,
      "formal_storage_migration_exists": false,
      "historical_evaluator_exists": false,
      "formal_historical_run_exists": false,
      "holdout_has_been_opened": false
    },
    "approval_source_binding": {
      "specification_path": "产业卡点及事件驱动系统/03_规则与规格/Stage6_6B历史准入状态确认与原子留存精确规则包_v0.1.md",
      "specification_raw_sha256": "96ec47da0eb356f726db3ce1be8015366ad3a804cc3f93d63c5b1c3fc65e3f5a",
      "draft_proposal_path": "产业卡点及事件驱动系统/03_规则与规格/机器制品/industrial_event_stage6_6b_historical_admission_atomic_retention_v0.1.0-draft.rule-bundle.json",
      "draft_raw_sha256": "4a5ed454e6ab152e03dc83b9723f035eacd020ff4bfe16d742427b4aaff827e4",
      "draft_bundle_sha256": "0ef8808f8de5e44991bbdecb5bb6a63f1b408d0650fd395c958af454adb262d4",
      "draft_rules_sha256": "4cd66370471d22169f1308ad4cc9f16852b5b6ebe1f20832ca3de6e30598a73b",
      "draft_owner_items_sha256": "17d1d3dabb4d68e8917ce008f6494d644c006c7a4d57f27a81a2e89260a2a3d8",
      "accepted_rule_source": "exact_draft_rules_by_canonical_sha256",
      "semantic_mutation_during_approval": false,
      "source_files_remain_immutable": true
    },
    "document_binding": {
      "path": "产业卡点及事件驱动系统/03_规则与规格/Stage6_6B历史准入状态确认与原子留存批准记录_v0.1.md",
      "hash": {
        "algorithm": "sha256",
        "value": "040cbe7dc04b0c153d8cd5902486dc4ffb8830c1018bccbfa747678663935aac"
      },
      "traceability_only": true
    },
    "phase_authority": {
      "6A": "approved_governance_only",
      "6B": "approved_isolated_validation_only_implementation",
      "6C": "not_authorized",
      "6D": "not_authorized",
      "formal_state_migration": "not_authorized",
      "approval_or_completion_is_not_transitive": true,
      "next_allowed_action": "implement_and_accept_isolated_stage6b_admission_validation"
    },
    "owner_approval_items": [
      {"approval_item_id": "6B-01", "status": "approved"},
      {"approval_item_id": "6B-02", "status": "approved"},
      {"approval_item_id": "6B-03", "status": "approved"},
      {"approval_item_id": "6B-04", "status": "approved"},
      {"approval_item_id": "6B-05", "status": "approved"},
      {"approval_item_id": "6B-06", "status": "approved"},
      {"approval_item_id": "6B-07", "status": "approved"},
      {"approval_item_id": "6B-08", "status": "approved"},
      {"approval_item_id": "6B-09", "status": "approved"},
      {"approval_item_id": "6B-10", "status": "approved"},
      {"approval_item_id": "6B-11", "status": "approved"},
      {"approval_item_id": "6B-12", "status": "approved"},
      {"approval_item_id": "6B-13", "status": "approved"},
      {"approval_item_id": "6B-14", "status": "approved"},
      {"approval_item_id": "6B-15", "status": "approved"},
      {"approval_item_id": "6B-16", "status": "approved"},
      {"approval_item_id": "6B-17", "status": "approved"},
      {"approval_item_id": "6B-18", "status": "approved"},
      {"approval_item_id": "6B-19", "status": "approved"},
      {"approval_item_id": "6B-20", "status": "approved"},
      {"approval_item_id": "6B-21", "status": "approved"},
      {"approval_item_id": "6B-22", "status": "approved"},
      {"approval_item_id": "6B-23", "status": "approved"},
      {"approval_item_id": "6B-24", "status": "approved"},
      {"approval_item_id": "6B-25", "status": "approved"},
      {"approval_item_id": "6B-26", "status": "approved"},
      {"approval_item_id": "6B-27", "status": "approved"},
      {"approval_item_id": "6B-28", "status": "approved"},
      {"approval_item_id": "6B-29", "status": "approved"},
      {"approval_item_id": "6B-30", "status": "approved"},
      {"approval_item_id": "6B-31", "status": "approved"},
      {"approval_item_id": "6B-32", "status": "approved"}
    ],
    "owner_approval_atomicity": {
      "all_32_required": true,
      "authorization_predicate": "all(6B-01..6B-32==approved)",
      "same_exact_bundle_and_approval_record_required": true,
      "partial_capability_forbidden": true,
      "partial_implementation_authority_forbidden": true
    },
    "approved_semantic_guards": {
      "one_external_strategy_input_ref": true,
      "complete_transitive_release_closure_required": true,
      "authority_contract_hash": "07d3e6a03aa45f38604ecd3728b2ad64b34c075dfc94032431a4486911692238",
      "fresh_public_https_status_required": true,
      "confirmation_items_equal_complete_closure": true,
      "seal_is_only_admission_completion_marker": true,
      "any_failure_authoritative_rows_and_evaluator_calls_are_zero": true,
      "validation_store_is_temporary_and_isolated": true,
      "stage5d_sqlite_v4_reuse_forbidden": true,
      "formal_state_migration_requires_separate_owner_approval": true,
      "withdrawal_blocks_new_seal_and_preserves_audit_only_history": true,
      "formal_historical_run_and_strategy_evaluator_remain_unauthorized": true,
      "stage6c_and_stage6d_remain_unauthorized": true,
      "all_outputs_authority_eligible_false": true
    },
    "runtime_must_not_parse_markdown": true
  }
}
