{
  "schema_version": "0.1.0-draft",
  "strategy_id": "industrial_bottleneck_event",
  "bundle_id": "industrial_event_stage6_6a_historical_validation_preregistration",
  "bundle_version": "0.1.0",
  "declared_status": "approved",
  "rules": {
    "authorization_boundary": {
      "approval_scope": "stage6_historical_validation_governance",
      "allowed_run_modes": [],
      "governance_capability_issued": true,
      "authorizes_forming_stage6b_draft": true,
      "authorizes_stage6b_implementation": false,
      "authorizes_stage6c_execution": false,
      "authorizes_stage6d_holdout": false,
      "authorizes_historical_run": false,
      "authorizes_release_status_confirmation": false,
      "authorizes_state_persistence": false,
      "authorizes_holdout_open": false,
      "authorizes_backtest": false,
      "authorizes_paper": false,
      "authorizes_shadow": false,
      "authorizes_live": false,
      "authorizes_positions": false,
      "authorizes_orders": false,
      "authorizes_broker_connection": false,
      "authorizes_kb_internal_reads": false,
      "authorizes_kb_writes": false,
      "authorizes_funds_deployment": false
    },
    "batch": {
      "stage": "Stage 6",
      "batch_id": "6A",
      "purpose": "approved_historical_validation_preregistration_governance",
      "owner_approval_required": true,
      "approval_items_required": 35,
      "approved_items": 35,
      "approved_machine_bundle_exists": true,
      "approval_record_exists": true,
      "governance_capability_verifier_exists": true,
      "historical_evaluator_exists": false,
      "release_confirmation_issuer_exists": false,
      "state_persistence_exists": false,
      "holdout_has_been_opened": false
    },
    "approval_source_binding": {
      "specification_path": "产业卡点及事件驱动系统/03_规则与规格/Stage6_6A历史验证预注册与准入精确规则包_v0.1.md",
      "specification_raw_sha256": "7ef1126261ddbead37c016fe472a8d518cddb553fe3c3d1214f5c378a9b964df",
      "draft_proposal_path": "产业卡点及事件驱动系统/03_规则与规格/机器制品/industrial_event_stage6_6a_historical_validation_preregistration_v0.1.0-draft.rule-bundle.json",
      "draft_raw_sha256": "a071e2509bcf86361836cdd5e5d0748748b607e1129edc4f47c308de7073cdca",
      "draft_bundle_sha256": "41759cb4e4db282d98bc70b3a599f632283d2cf79330adab910b1bc9a308eb92",
      "draft_rules_sha256": "c1d0298488317318b8d9dedde9f1ff719aa83d08af7196d255482e11522dc097",
      "draft_owner_items_sha256": "ea2b4b9d232884d3cd12b4a8003562261fc8e6c8e8f299b88f1df1fb16e3fcfe",
      "accepted_rule_source": "exact_draft_rules_by_canonical_sha256",
      "semantic_mutation_during_approval": false,
      "source_files_remain_immutable": true
    },
    "document_binding": {
      "path": "产业卡点及事件驱动系统/03_规则与规格/Stage6_6A历史验证预注册与准入批准记录_v0.1.md",
      "hash": {
        "algorithm": "sha256",
        "value": "392eb5461c3e1c0e2ff3654fe0eea729de2671adb0bc5207854b98f8fbe79b9f"
      },
      "traceability_only": true
    },
    "phase_authority": {
      "6A": "approved_governance_only",
      "6B": "not_authorized",
      "6C": "not_authorized",
      "6D": "not_authorized",
      "approval_or_completion_is_not_transitive": true,
      "next_allowed_action": "form_exact_stage6b_draft_for_owner_review"
    },
    "owner_approval_items": [
      {"approval_item_id": "6A-01", "status": "approved"},
      {"approval_item_id": "6A-02", "status": "approved"},
      {"approval_item_id": "6A-03", "status": "approved"},
      {"approval_item_id": "6A-04", "status": "approved"},
      {"approval_item_id": "6A-05", "status": "approved"},
      {"approval_item_id": "6A-06", "status": "approved"},
      {"approval_item_id": "6A-07", "status": "approved"},
      {"approval_item_id": "6A-08", "status": "approved"},
      {"approval_item_id": "6A-09", "status": "approved"},
      {"approval_item_id": "6A-10", "status": "approved"},
      {"approval_item_id": "6A-11", "status": "approved"},
      {"approval_item_id": "6A-12", "status": "approved"},
      {"approval_item_id": "6A-13", "status": "approved"},
      {"approval_item_id": "6A-14", "status": "approved"},
      {"approval_item_id": "6A-15", "status": "approved"},
      {"approval_item_id": "6A-16", "status": "approved"},
      {"approval_item_id": "6A-17", "status": "approved"},
      {"approval_item_id": "6A-18", "status": "approved"},
      {"approval_item_id": "6A-19", "status": "approved"},
      {"approval_item_id": "6A-20", "status": "approved"},
      {"approval_item_id": "6A-21", "status": "approved"},
      {"approval_item_id": "6A-22", "status": "approved"},
      {"approval_item_id": "6A-23", "status": "approved"},
      {"approval_item_id": "6A-24", "status": "approved"},
      {"approval_item_id": "6A-25", "status": "approved"},
      {"approval_item_id": "6A-26", "status": "approved"},
      {"approval_item_id": "6A-27", "status": "approved"},
      {"approval_item_id": "6A-28", "status": "approved"},
      {"approval_item_id": "6A-29", "status": "approved"},
      {"approval_item_id": "6A-30", "status": "approved"},
      {"approval_item_id": "6A-31", "status": "approved"},
      {"approval_item_id": "6A-32", "status": "approved"},
      {"approval_item_id": "6A-33", "status": "approved"},
      {"approval_item_id": "6A-34", "status": "approved"},
      {"approval_item_id": "6A-35", "status": "approved"}
    ],
    "owner_approval_atomicity": {
      "all_35_required": true,
      "authorization_predicate": "all(6A-01..6A-35==approved)",
      "same_exact_bundle_and_approval_record_required": true,
      "partial_capability_forbidden": true,
      "partial_implementation_authority_forbidden": true
    },
    "approved_semantic_guards": {
      "preregistration_frozen_before_performance": true,
      "historical_admission_requires_separate_stage6b_approval": true,
      "unsupported_stage5d_input_remains_blocked_or_abstain": true,
      "coverage_failure_is_insufficient_evidence": true,
      "holdout_tuning_forbidden": true,
      "full_system_must_beat_best_simple_competitor": true,
      "prd_numeric_thresholds_remain_hypothesis": true,
      "historical_result_is_not_forward_or_live_evidence": true
    },
    "runtime_must_not_parse_markdown": true
  }
}
